番号,おすすめ商品名,写真ファイル名,商品の種類（１：料理 2:和菓子 3:お土産 4:工芸品 6:その他）,お店の名前,住所,緯度,経度,紹介,定休日,営業時間
1,わらび餅,warabi.jpg,2,和菓子 村上 本店,金沢市長町2-3-32,36.564025,136.6497,店内人気の定番和菓子である「日向夏わり氷」や「今月の上生菓子」、「わらび餅」,年中無休,08:30～17:00（夏季～18:00)
2,オリジナル商品,original.jpg,1,ひらみぱん,石川県金沢市長町1-6-11,36.566333,136.6510441,大正時代の鉄工所跡を利用したオシャレな外観に落ち着いた雰囲気、かわいいオリジナルグッズに美味しい食べ物,月曜日,モーニング ０８：００～１１：００、ランチ　１２：００～１４：００、カフェ　１４：００～１６：００、ディナー １８：００～
3,九谷焼のテーブルウェア,kutani_table.jpg,4,［g］ift（ギフト）,石川県金沢市広坂1-2-18　中村ビル 1F,36.5616823,136.6572545,北陸3県の伝統工芸から雑貨、食品などの様々な商品が揃うセレクトショップ。,月・火（いずれか祝休日の場合は平日へずれてお休みします）、年末年始,10:00～18:00
4,ミニ下駄,mini_geta.jpg,3,九谷焼窯元　鏑木商舗（金沢九谷ミュウジアム内）,石川県金沢市長町１丁目３－１６,36.5638389,136.6508776,長町武家屋敷の近くの、風情ある和風建築のお店。谷焼のさまざまな商品がディスプレイされています。,不定休,９：００～２２：００(日曜･祝日：～１８：００)
5,アクセサリー,accessories.jpg,3,茶菓子工房 たろう 鬼川店,石川県金沢市長町１丁目3-32,36.5641111,136.6500859,自然な色合いが特徴の一粒菓子「もりの音」や、生チョコのような味わいが特徴の「たろうのようかん」、また、最近新登場した「はなことたろう」というアーモンド入りカカオ羊羹等、素敵な商品が並ぶ素敵なお店。,年中無休,8:30-17:30
6,お菓子の香りの線香,senko.jpg,3,アロマ工房「焚屋」,石川県金沢市長町1-2-23,36.5633751,136.6522608,店内いろいろなかおりが漂っているアロマ工房。おすすめは「ぽち香」。観光客がおみやげで買っていく,毎週火曜日 祭日は営業,11:00～20:00
7,てまり,temari.jpg,4,加賀てまり 鞠屋,石川県金沢市南町5-7　小出南ビル1階,36.5665196,136.6541923,加賀てまりは娘が嫁ぐ際に、魔よけとして持たせるもの。手作りのてまりを扱うお店。お土産にストラップやイヤリングなどおすすめ。,火曜・水曜,午前9：30～午後6：00
8,ことみん,kotomin.jpg,1,古都美(ことみ),石川県金沢市広坂1丁目2-27,36.5615504,136.6582938,21世紀美術館のすぐ近くにあり、いつもパフェの看板が立っており、入口が奥まっていて、隠れ家のような雰囲気がすてきなカフェ＆スイーツショップ,月曜日 火曜不定休,1F ショップ 午前11:00～午後18:00、2F カフェ 午前11:00～午後18:00
